{"$schema":"https://json-schema.org/draft/2020-12/schema","$id":"https://github.com/rezahh107/EV4-Constructability-Engineer-Repo/schemas/ce_architect_stage_intake.v1.schema.json","title":"EV4 CE Architect Stage Intake v1","type":"object","additionalProperties":false,"required":["schema_id","schema_version","owner_repository","intake_status","synthetic","source_contract","source_repository_ref","selected_architecture","structure_projection","architect_intent_preserved","evidence_register","unresolved_evidence","forbidden_work","negative_boundary_assertions","ce_processing_prerequisites","mapping_contract","mapping_trace","legacy_contract_policy","real_cross_repository_validation","validation_contract"],"properties":{"schema_id":{"const":"ev4-ce-architect-stage-intake@1.0.0"},"schema_version":{"const":"1.0.0"},"owner_repository":{"const":"rezahh107/EV4-Constructability-Engineer-Repo"},"intake_status":{"enum":["complete","insufficient_evidence"]},"synthetic":{"type":"boolean"},"source_contract":{"type":"object","additionalProperties":false,"required":["schema_id","schema_version","owner_repository","accepted_main_merge_commit"],"properties":{"schema_id":{"const":"ev4-architect-stage-payload@1.0.0"},"schema_version":{"const":"1.0.0"},"owner_repository":{"const":"rezahh107/EV4-Architect-Repo"},"accepted_main_merge_commit":{"const":"b0651668b97f682bb17f66840c8e8c503fd3935d"}}},"source_repository_ref":{"type":"object","additionalProperties":false,"required":["repository","ref"],"properties":{"repository":{"const":"rezahh107/EV4-Architect-Repo"},"ref":{"$ref":"#/$defs/s"},"commit_sha":{"type":"string","pattern":"^[a-f0-9]{40}$"},"bundle_id":{"$ref":"#/$defs/s"}}},"selected_architecture":{"type":"object","additionalProperties":false,"required":["selected_candidate_id","selected_candidate_locked","architecture_family","decision_source_refs","approved_structure_ref"],"properties":{"selected_candidate_id":{"$ref":"#/$defs/id"},"selected_candidate_locked":{"const":true},"architecture_family":{"$ref":"#/$defs/s"},"decision_source_refs":{"$ref":"#/$defs/refs"},"approved_structure_ref":{"$ref":"#/$defs/id"}}},"structure_projection":{"type":"object","additionalProperties":false,"required":["root_node_id","nodes"],"properties":{"root_node_id":{"$ref":"#/$defs/id"},"nodes":{"type":"array","minItems":1,"items":{"type":"object","additionalProperties":false,"required":["source_node_id","parent_node_id","node_kind","role","evidence_refs","children"],"properties":{"source_node_id":{"$ref":"#/$defs/id"},"parent_node_id":{"anyOf":[{"type":"null"},{"$ref":"#/$defs/id"}]},"node_kind":{"enum":["section_root","structural_container","content_group","widget","decoration_layer","overlay_stage","connector_layer","wrapper","component_candidate"]},"role":{"$ref":"#/$defs/s"},"evidence_refs":{"$ref":"#/$defs/refs"},"children":{"type":"array","items":{"$ref":"#/$defs/id"},"uniqueItems":true}}}}}},"architect_intent_preserved":{"type":"object","additionalProperties":false,"required":["class_intent","responsive_risk_seeds","dynamic_loop_intent"],"properties":{"class_intent":{"type":"object","additionalProperties":false,"required":["approved_class_names"],"properties":{"approved_class_names":{"type":"array","minItems":1,"uniqueItems":true,"items":{"type":"string","pattern":"^[a-z][a-z0-9-]*(?:__[a-z0-9-]+)?(?:--[a-z0-9-]+)?$"}}}},"responsive_risk_seeds":{"type":"array","minItems":1,"items":{"type":"object","additionalProperties":false,"required":["risk_id","state","evidence_refs"],"properties":{"risk_id":{"$ref":"#/$defs/id"},"state":{"const":"insufficient_evidence"},"evidence_refs":{"$ref":"#/$defs/refs"}}}},"dynamic_loop_intent":{"type":"object","additionalProperties":false,"required":["status","evidence_refs"],"properties":{"status":{"enum":["none","not_applicable","possible","unknown","approved"]},"evidence_refs":{"type":"array","items":{"$ref":"#/$defs/eref"},"uniqueItems":true}}}}},"evidence_register":{"type":"array","minItems":1,"uniqueItems":true,"items":{"type":"object","additionalProperties":false,"required":["evidence_id","state","source_ref","claim","fact_class"],"properties":{"evidence_id":{"$ref":"#/$defs/eref"},"state":{"$ref":"#/$defs/state"},"source_ref":{"type":"object","additionalProperties":false,"required":["source_type","reference"],"properties":{"source_type":{"enum":["stage_payload","repo_path","contract","schema","fixture","manual_observation","synthetic_fixture"]},"reference":{"$ref":"#/$defs/s"}}},"claim":{"$ref":"#/$defs/s"},"fact_class":{"enum":["project_specific_behavior","platform_capability","project_default","project_conceptual_model","unresolved_unknown","audit_finding","contract_rule","not_claimed","synthetic_fixture"]}}}},"unresolved_evidence":{"type":"array","items":{"type":"object","additionalProperties":false,"required":["unresolved_id","state","owner","reason","evidence_refs"],"properties":{"unresolved_id":{"$ref":"#/$defs/id"},"state":{"const":"insufficient_evidence"},"owner":{"enum":["architect","ce","builder","responsive","user","unresolved"]},"reason":{"$ref":"#/$defs/s"},"evidence_refs":{"type":"array","items":{"$ref":"#/$defs/eref"},"uniqueItems":true}}}},"missing_evidence":{"type":"array","items":{"type":"object","additionalProperties":false,"required":["missing_id","affected_ce_conclusion","required_source","current_evidence_owner","ce_processing_can_partially_continue"],"properties":{"missing_id":{"$ref":"#/$defs/id"},"affected_ce_conclusion":{"enum":["intake_acceptance","constructability_review_scope","implementation_strategy","builder_authorization","responsive_validation","production_readiness"]},"required_source":{"$ref":"#/$defs/s"},"current_evidence_owner":{"enum":["architect","ce","builder","responsive","user","unresolved"]},"ce_processing_can_partially_continue":{"type":"boolean"}}}},"forbidden_work":{"type":"array","minItems":1,"uniqueItems":true,"items":{"$ref":"#/$defs/s"}},"negative_boundary_assertions":{"type":"object","additionalProperties":false,"required":["constructability_proven","ce_approved","implementation_strategy_selected","elementor_feasibility_proven","proof_state_resolved","ce_review_complete","builder_ready","builder_executable","builder_action_authorized","builder_runtime_intake_authorized","production_ready","responsive_complete"],"properties":{"constructability_proven":{"const":false},"ce_approved":{"const":false},"implementation_strategy_selected":{"const":false},"elementor_feasibility_proven":{"const":false},"proof_state_resolved":{"const":false},"ce_review_complete":{"const":false},"builder_ready":{"const":false},"builder_executable":{"const":false},"builder_action_authorized":{"const":false},"builder_runtime_intake_authorized":{"const":false},"production_ready":{"const":false},"responsive_complete":{"const":false}}},"ce_processing_prerequisites":{"type":"object","additionalProperties":false,"required":["ce_review_required","intake_contains_ce_conclusions","intake_contains_builder_authorization","project_gate_transition_implemented","real_cross_repository_validation_available"],"properties":{"ce_review_required":{"const":true},"intake_contains_ce_conclusions":{"const":false},"intake_contains_builder_authorization":{"const":false},"project_gate_transition_implemented":{"const":false},"real_cross_repository_validation_available":{"const":false}}},"mapping_contract":{"type":"object","additionalProperties":false,"required":["mapping_id","mapping_version","source_schema_id","target_schema_id"],"properties":{"mapping_id":{"const":"ev4-architect-stage-to-ce-intake-mapping@1.0.0"},"mapping_version":{"const":"1.0.0"},"source_schema_id":{"const":"ev4-architect-stage-payload@1.0.0"},"target_schema_id":{"const":"ev4-ce-architect-stage-intake@1.0.0"}}},"mapping_trace":{"type":"array","minItems":1,"items":{"type":"object","additionalProperties":false,"required":["source_path","target_path","classification","ordering_rule","missing_source_behavior","duplicate_behavior","unsupported_field_behavior","provenance_behavior","unresolved_evidence_behavior"],"properties":{"source_path":{"$ref":"#/$defs/s"},"target_path":{"$ref":"#/$defs/s"},"classification":{"enum":["direct_evidence_copy","allowed_representation_conversion","deterministic_structural_projection","not_applicable","unsupported"]},"ordering_rule":{"enum":["preserve_source_order","sort_by_id","sort_by_source_path_then_target_path","not_applicable"]},"missing_source_behavior":{"enum":["invalid","insufficient_evidence","omit_if_optional","not_applicable"]},"duplicate_behavior":{"enum":["reject","deduplicate_stable_order","preserve","not_applicable"]},"unsupported_field_behavior":{"enum":["reject","preserve_as_provenance_only","not_applicable"]},"provenance_behavior":{"enum":["copy_exact","preserve_reference","not_applicable"]},"unresolved_evidence_behavior":{"enum":["copy_exact","preserve_unresolved","not_applicable"]}}}},"legacy_contract_policy":{"type":"object","additionalProperties":false,"required":["canonical_architect_facing_intake","legacy_status"],"properties":{"canonical_architect_facing_intake":{"const":"ev4-ce-architect-stage-intake@1.0.0"},"legacy_status":{"const":"compatibility_only"}}},"real_cross_repository_validation":{"const":"not_available"},"validation_contract":{"type":"object","additionalProperties":false,"required":["rules"],"properties":{"rules":{"type":"array","minItems":12,"uniqueItems":true,"items":{"enum":["CE-I01","CE-I02","CE-I03","CE-I04","CE-I05","CE-I06","CE-I07","CE-I08","CE-I09","CE-I10","CE-I11","CE-I12"]}}}}},"allOf":[{"if":{"properties":{"intake_status":{"const":"insufficient_evidence"}},"required":["intake_status"]},"then":{"required":["missing_evidence"],"properties":{"missing_evidence":{"minItems":1}}}}],"$defs":{"s":{"type":"string","minLength":1,"pattern":"\\S"},"id":{"type":"string","minLength":1,"pattern":"^[A-Za-z][A-Za-z0-9._:-]*$"},"eref":{"type":"string","minLength":1,"pattern":"^[A-Za-z][A-Za-z0-9._:-]*$"},"refs":{"type":"array","minItems":1,"uniqueItems":true,"items":{"$ref":"#/$defs/eref"}},"state":{"enum":["observed","validated","resolved","derived","proposed","unverified","insufficient_evidence"]}}}
